<?xml version="1.0" encoding="UTF-8"?>
<!-- - - Licensed under the Apache License, Version 2.0 (the "License"); 
	- you may not use this file except in compliance with the License. - You 
	may obtain a copy of the License at - - http://www.apache.org/licenses/LICENSE-2.0 
	- - Unless required by applicable law or agreed to in writing, software - 
	distributed under the License is distributed on an "AS IS" BASIS, - WITHOUT 
	WARRANTIES OR CONDITIONS OF ANY KIND, either express or implied. - See the 
	License for the specific language governing permissions and - limitations 
	under the License. -->
<!DOCTYPE mycat:server SYSTEM "server.dtd">
<mycat:server xmlns:mycat="http://io.mycat/">
	<system>
        <property name="nonePasswordLogin">0</property> <!-- 0为需要密码登陆、1为不需要密码登陆 ,默认为0，设置为1则需要指定默认账户-->
        <property name="useHandshakeV10">1</property>
        <property name="useSqlStat">0</property>  <!-- 1为开启实时统计、0为关闭 -->
        <property name="useGlobleTableCheck">0</property>  <!-- 1为开启全加班一致性检测、0为关闭 -->
		<property name="sequnceHandlerType">2</property>
		<property name="processorBufferPoolType">0</property>
		<property name="handleDistributedTransactions">0</property>
		<property name="useOffHeapForMerge">1</property>
        <property name="memoryPageSize">64k</property>
		<property name="spillsFileBufferSize">1k</property>
		<property name="useStreamOutput">0</property>
		<property name="systemReserveMemorySize">384m</property>
		<property name="useZKSwitch">false</property>
	</system>

	<user name="root" defaultAccount="true">
		<property name="password">123456</property>
		<property name="schemas">dbtest</property>
	</user>

</mycat:server>
