<?xml version="1.0" encoding="UTF-8"?>
<!-- - - Licensed under the Apache License, Version 2.0 (the "License");
	- you may not use this file except in compliance with the License. - You
	may obtain a copy of the License at - - http://www.apache.org/licenses/LICENSE-2.0
	- - Unless required by applicable law or agreed to in writing, software -
	distributed under the License is distributed on an "AS IS" BASIS, - WITHOUT
	WARRANTIES OR CONDITIONS OF ANY KIND, either express or implied. - See the
	License for the specific language governing permissions and - limitations
	under the License. -->
<!DOCTYPE mycat:server SYSTEM "server.dtd">
<mycat:server xmlns:mycat="http://org.opencloudb/">
	<system>
		<property name="defaultSqlParser">druidparser</property>
		<property name="sqlInterceptor">org.opencloudb.interceptor.impl.StatisticsSqlInterceptor</property>
		<property name="sqlInterceptorType">select</property>
		<property name="sqlInterceptorFile">E:/mycat/sql.txt</property>
		<property name="sequnceHandlerType">1</property>
	</system>
	<user name="mycat">
		<property name="password">mycat</property>
		<property name="schemas">mycat</property>
	</user>
	<!-- <cluster multicast_discovery="on">
		<node name="node1">
			<property name="host">192.168.0.1</property>
			<property name="name">node1</property>
			<property name="port">9092</property>
			<property name="mgrport">9093</property>
			<property name="weight">1</property>

		</node>
		<node name="node2">
			<property name="host">192.168.0.2</property>
			<property name="name">node1</property>
			<property name="port">9092</property>
			<property name="mgrport">9093</property>
			<property name="weight">1</property>

		</node>

		<group name="group" local="node1">
			<property name="nodeList">node1,node2</property>

		</group>
	</cluster> -->

</mycat:server>
